Song Title,Artist,Song URL,Lyrics
alexander hamilton,Leslie Odom Jr.,https://genius.com/Leslie-odom-jr-anthony-ramos-daveed-diggs-okieriete-onaodowan-lin-manuel-miranda-phillipa-soo-christopher-jackson-and-original-broadway-cast-of-hamilton-alexander-hamilton-lyrics,bosanski alexander hamilton hamilton overture eleven note orchestral introduction hamilton seven rhythmic orchestral note rhythmic motif throwing away shot four string note bastard orphan son whore scotsman dropped middle forgotten spot caribbean providence impoverished squalor grow hero scholar ten dollar founding father without father lot farther working lot harder lot smarter self starter fourteen placed charge trading charter every day slave slaughtered carted away across wave struggled kept guard inside longing something brother ready beg steal borrow barter hurricane came devastation reigned saw future drip dripping drain put pencil temple connected brain wrote first testament pain well word around said kid insane took collection send mainland education forget whence came world gon name name alexander hamilton name alexander hamilton million thing done wait wait ten father split full debt ridden two year later alex mother bed ridden half dead sittin sick scent thick alex better mother went quick george washington washington company moved cousin cousin committed suicide left nothin ruined pride something new inside voice sayin alex ta fend started retreatin readin every treatise shelf burr company burr company would nothin left someone less astute woulda dead destitute without cent restitution started workin clerkin late mother landlord tradin sugar cane rum thing afford scammin every book hand plannin future stand bow ship headed new land new york new company hamilton new york new wait new york new wait new york new woman men new york new york wait alexander hamilton waiting wing could never back never learned take time alexander hamilton america sings overcame rewrote game world never burr men company ship harbor spot wait another immigrant comin bottom wait enemy destroyed rep america forgot fought died trusted loved damn fool shot million thing done wait name alexander hamilton
die smile,Lady Gaga,https://genius.com/Lady-gaga-and-bruno-mars-die-with-a-smile-lyrics,ti ng vi bahasa indonesia dansk die smile die smile comeback single lady gaga bruno mar released music two three year song surprise announced day release august woke dream goodbye mean since survived realized wherever follow nobody promised tomorrow love every night last night last night world ending wan next party time earth wan hold die smile world ending wan next lady gaga lady gaga bruno mar lost lost word scream even wan anymore already mean love war worth fighting wherever follow nobody promised tomorrow love every night last night last night lady gaga bruno mar lady gaga world ending wan next party time earth wan hold die smile world ending wan next bruno mar lady gaga right next next right next lady gaga lady gaga bruno mar bruno mar world ending wan next party time earth wan hold die smile world ending wan next world ending wan next bruno mar lady gaga bruno mar wan next
dna,Kendrick Lamar,https://genius.com/Kendrick-lamar-dna-lyrics,bosanski dna dna kendrick lamar adopts multiple viewpoint celebrating critiquing exploring black heritage culture music video kendrick actor cheadle appear trade bar engaging loyalty royalty inside dna cocaine quarter piece war peace inside dna power poison pain joy inside dna hustle though ambition flow inside dna born since one immaculate conception transform perform yeshua new weapon contemplate meditate fucking head put kid bed realness kill shit dna million rich buildin dna dark evil rot inside dna troublesome heart inside dna win win wimbledon serve sound engine bird firework corvette tire skrrt boulevard work hormone prolly switch inside dna problem sucker shit inside dna daddy prolly snitched heritage inside dna backbone exist born outside jellyfish gauge pedigree definitely tolerate front shit prolly offend paula oldest son murder conviction burner booster burglar ballers dead redemption scholar father dead kid wish fed forgiveness soldier dna soldier dna born inside beast expertise checked second grade nine sale motel nowhere stay twenty nine done well hit cartwheel estate gon shine supposed antisocial extrovert excellent mean extra work absentness fuck heard pessimist never struck nerve nazareth gon plead case reason power earth salute truth prophet kendrick lamar geraldo rivera loyalty royalty inside dna hip hop done damage young african american racism recent year loyalty royalty inside dna live better life rollin several dice fuck life loyalty royalty inside dna live fuck life five four three two one heritage inheritin money power mecca marriage somethin motherfucker nothin rather die listen dna imitation dna abomination matrix dodgin bullet reapin sow stackin footage livin sleepin villa sippin grammy walkin buildin diamond ceilin marble floor beach inside window peekin window baby pool godfather goal lord know goin hammer dodgin paparazzo freakin camera eat four daughter brock wearin sandal yoga monday stretchin nirvana watchin snake curvin fake phone never conversate compromise penetrate sex money murder break time level number nine look sky ten way sentence way killing way motherfucker winner way shit without body belt shit without ticket plate sick enough pull rich enough hit lot skate destruction gon fate gon fate gon faith peace world rotate sex money murder dna
holy grail,JAŸ-Z,https://genius.com/Jay-z-holy-grail-lyrics,holy grail first track released magna carta holy grail deal love hate affair jay justin timberlake fame hov dub newrules samsung user able take clothes back steal food right mouth watch eat still love much thanks warning thanks warning curse name spite put shame hang laundry street dirty clean give fame still love much thanks warning thanks warning justin timberlake jay baby amazin maze crack code one day screamin love loud next day cold one day one day one day care unfair sippin cup til runneth holy grail blue told remind fuck shit talkin bout caught light camera look shit hammer goddamn bright light enticin look tyson money one night thirty mil one fight soon money blow pigeon take flight fuck fame keep cheatin took back fool twice bad even blame enough wan murder momma please bail nobody blame kurt cobain entertainer stupid contagious entertaine baby amazin maze crack code one day screamin love loud next day cold one day one day one day care unfair sippin cup til runneth holy grail tattoo body psycho bitch lobby hater paper photo shoot paparazzo even take daughter walk em corner store feel cornered enough enough callin fuck kiddin though gettin high sittin low slidin big body curtain window fame hurt chain worse think back asked person deal deal shit work light work camera snappin eye hurt dyin back birthed fuck iris irs hell high horse shit die dry mad take good bad throw baby bath water still alive still survived still gettin bigger livin life vanilla wafer villa illest alive michael jackson thriller justin timberlake jay baby amazin maze crack code one day screamin love loud next day cold one day one day one day care unfair sippin cup til runneth holy grail air lung whenever need take blade right heart watch bleed still love much thanks warning thanks warning play game spite drive insane tattooed sleeve forever ink guess whose name still love much thanks warning thanks warning justin timberlake jay baby amazin maze crack code one day screamin love loud next day cold one day one day one day care unfair sippin cup til runneth holy grail holy holy holy holy holy holy grail holy holy holy holy holy holy grail
look,XXXTENTACION,https://genius.com/Xxxtentacion-look-at-me-lyrics,norsk sloven ina look first released december via soundcloud look quickly grew notorious receiving second surge popularity late january drake previewed song eventually released man keep dick pant love mo kick vro damn son find haha man keep dick pant love mo kick vro wan friend gave dick amen put tongue dick look wrist ten pound boof brought shit straight booth tommy hilfiger voots said wan fuck put gun man put hole parent lean ksubis uzi uzi fuck look fuck yah look look look yah fuck yah look yah fuck look fuck yah look fuck yah fuck voot pipe shout ban took white starbucks little throat fucked rock misfit emo wrist slit curly hair corbin three bitch mormon skeet main forehead want pussy want head look fuck look fuck look fuck look yah look fuck look fuck look fuck look yah
well minute version taylor version vault,Taylor Swift,https://genius.com/Taylor-swift-all-too-well-10-minute-version-taylors-version-from-the-vault-lyrics,magyar afrikaans norsk sloven ina dansk ti ng vi catal well widely regarded one swift best song well see picking shard memory gut wrenching breakup jump time reflect best worst memory ex walked door air cold somethin bout felt home somehow left scarf sister house still drawer even sweet disposition wide eyed gaze singin car getting lost upstate autumn leaf fallin piece place picture day long gone magic might okay fine caus ar little town street almost ran red lookin wind hair remember well photo album counter cheek turnin red used little kid glass twin sized bed mother tellin story bout tee ball team taught bout past thinkin future tossing car key fuck patriarchy keychain ground always skippin town thinkin drive time gon love never called til dead gone buried check pulse back swearin three month grave wondered went reached felt shame held lifeless frame long gone nothing else could forget long enough forget needed middle night dancin round kitchen refrigerator light stair remember well nobody kept secret kept oath sacred prayer swear remember well well maybe lost maybe asked much maybe thing masterpiece til tore runnin scared remember well call break promise casually cruel name bein honest crumpled piece paper lyin remember well end well new hell every time double cross mind said closer age maybe would fine made want die idea never needy ever lovely jewel whose shine reflects weepin party bathroom actress askin happened happened charmed dad self effacing joke sippin coffee late night show watched watch front door night willin said supposed fun turning twenty one time fly paralyzed old self still tryin find plaid shirt day night made mail back thing walk home alone keep old scarf first week reminds innocence smell rid remember well loved back lost one real thing ever known rare remember well wind hair remember stair remember rare remember well never good tellin joke punch line go older lover stay age brooklyn broke skin bone soldier returning half weight twin flame bruise paint blue u love affair maim city barren cold still remember first fall snow glistened fell remember well u love affair maim well u remember well u remember well wind hair stair sacred prayer rare remember well wind hair stair sacred prayer rare remember wind hair stair sacred prayer rare remember wind hair stair sacred prayer rare remember
one dance,Drake,https://genius.com/Drake-one-dance-lyrics,one dance one dance song dancehall afrobeats inflection slowed sample chord stab uk funky house anthem kyla mind crazy baby style grip waist front way back way play street safe never run away even away oti oti never much love ot pray back one piece pray pray need one dance hennessy hand one time fore higher power taking hold need one dance hennessy hand one time fore higher power taking hold baby style strength guidance wishing friend nobody make end bust silence ta stick soon text reply wan spend time fighting time need one dance hennessy hand one time fore higher power taking hold need one dance hennessy hand one time fore higher power taking hold pretty love long time fine wine love long time long time back back back whine back back whine back back back whine yes steady fine back back whine mm need wan take slow lose control breakdown kyla wizkid long time back back whine back back back back back back drake kyla need one dance hennessy hand one time fore higher power taking hold need one dance hennessy hand one time fore higher power taking hold spell hennessy put two two e hen henn henn definitely showing hennessy two e sure gon take one
formation,Beyoncé,https://genius.com/Beyonce-formation-lyrics,formation formation black power anthem fitting contribution black history month important conversation piece black life matter movement song released one day would happened new wil in back popular demand hater corny illuminati mess paparazzo catch fly cocky fresh reckless rock givenchy dress possessive rock roc necklace daddy alabama mama louisiana mix negro creole texas bama baby heir baby hair afro negro nose jackson five nostril earned money never take country hot sauce bag swag messy mya big freedia baby yes play hoe haha came slay cornbread collard green yes besta believe hater corny llluminati mess paparazzo catch fly cocky fresh reckless rock givenchy dress possessive rock roc necklace daddy alabama mama louisiana mix negro creole texas bama baby heir baby hair afro negro nose jackson five nostril earned money never take country hot sauce bag swag want stunt yellow bone dream work hard grind til twirl hater albino alligator el camino seat low sippin cuervo chaser sometimes hard mine star slay slay slay slay day slay slay slay gon slay gon slay slay slay slay okay slay okay okay okay okay okay okay lady formation slay okay lady formation slay prove coordination slay slay trick eliminated fuck good take as red lobster fuck good take as red lobster gon slay hit right might take flight chopper drop mall buy shop might song played radio station might song played radio station might black bill gate making might black bill gate making want stunt yellow bone dream work hard grind til twirl hater albino alligator el camino seat low sippin cuervo chaser sometimes hard take mine star slay slay slay slay slay slay slay slay gon slay gon slay slay slay slay okay slay okay okay okay okay okay okay lady formation slay okay lady formation slay prove coordination slay slay trick eliminated slay okay lady formation slay okay lady formation conversation always stay gracious best revenge paper hear thunder golly look water lord
mirror,Justin Timberlake,https://genius.com/Justin-timberlake-mirrors-lyrics,mirror love song jt new wife less narcissistic may seem first glance song tribute twin flame soul split two two different body justin dedicated music somethin admire shine somethin mirror help notice reflect heart mine ever feel alone glare make hard find always parallel side hand hand pocket full soul place put hand glass tryna pull ta strong wan lose lookin right half vacancy sat heart space hold show fight baby easy comin back figured right along mirror mirror staring back bigger anyone else beside clear promise making two reflection one mirror mirror staring back staring back somethin original seem merely assembled help stare truth somewhere eye ever change without reflect love could would look u time hand hand pocket full soul place put hand glass tryna pull ta strong wan lose lookin right half vacancy sat heart space hold show fight baby easy comin back figured right along mirror mirror staring back bigger anyone else beside clear promise making two reflection one mirror mirror staring back staring back yesterday history tomorrow mystery lookin back keep eye baby keep eye wan lose lookin right half vacancy sat heart space hold show fight baby easy comin back figured right along mirror mirror staring back bigger anyone else beside clear promise making two reflection one mirror mirror staring back staring back ohh ohh ohh ohh uhh ohh ohh ohh ohh ohh uhh ohh love life love life love life love life love life love life love life love life love life ohh ohh ohh ohh uhh ohh inspiration precious song wan face light since put goodbye old already gone wait wait wait wait wait home ohh ohh ohh ohh uhh ohh love life love life love life love life love life love life love life love life reflection reflection everything reflection reflection everything love life love life love life love life love life love life love life love life love life love life love life love life love life love life love life love life
panda,Desiigner,https://genius.com/Desiigner-panda-lyrics,panda panda inspired white bmw desiigner note luxury car resemblance previously endangered animal brooklyn based rapper vision breakout track playing ow listening hottest hottest beat net menace waitin guess waitin shit long time waitin guess waitin shit long time feelin vibe right feelin panda panda panda panda panda panda panda broad atlanta twistin dope lean fanta credit card scammer hittin lick bando black phantom white look panda goin montana hundred killas hundred hammer black phantom white panda pocket swole danny sellin bar candy macho randy chopper oscar grammy pull ya panty hope killas understand broad atlanta twistin dope lean fanta credit card scammer hittin lick bando black phantom white look panda goin montana hundred killas hundred hammer black phantom white panda pocket swole danny sellin bar candy macho randy chopper oscar grammy pull ya panty hope killas understand panda panda panda panda panda panda panda panda panda panda broad atlanta twistin dope lean shit sippin fanta credit card scammer wake versace shit life desiigner whole bunch lavish shit askin round town clappin shit pullin stuff phantom ship plenty stuff bugatti whip look drive shit black phantom white killin camera pop perc stand gorilla kill banana four fella finna pull phantom kill camera big rollie dancin bigger pandie oscar grammy pull ya panty fill flip bitch pull countin digit lot new money killer pull wraith ctd pull killa bape call phillip phillip gon fill bank bank gon drill bank fuck gon kill bank broad card shitted live ticket flex drop bomb spin bobby gon trend jeff doin business zana ray fuckin shit doin business gettin chicken countin chicken gon split panda panda panda panda panda panda panda broad atlanta twistin dope lean fanta credit card scammer hittin lick bando black phantom white look panda goin montana hundred killer hundred hammer black phantom white panda pocket swole danny sellin bar candy macho randy chopper oscar grammy pull ya panty hope killer understand broad atlanta twistin dope lean fanta credit card scammer hittin lick bando black phantom white look panda goin montana hundred killer hundred hammer black phantom white panda pocket swole danny sellin bar candy macho randy chopper oscar grammy pull ya panty hope killer understand panda panda panda panda panda panda panda panda panda panda
xxx,Kendrick Lamar,https://genius.com/Kendrick-lamar-xxx-lyrics,xxx kendrick team rock legend xxx delf deeper political religious theme heard throughout damn august interview rolling stone kendrick described kon kid capri america god bless good america please take hand help underst new kung fu kenny throw steak ark pool full shark take leave wilderness sworn nemesis take gratitude bet show somethin chip lil bit nothin chip lil bit nothin chip lil bit nothin chip throw blower lap walk court rated johnny wan school johnny said book cool johnny wan rapper big cousin johnny caught body yesterday hustlin god bless america love yesterday call dog said killed son insufficient fund sobbin mobbin way belligerent drunk talkin head philosophin lord done said dot pray fucked day anointed show overcome lookin closure hopin could bring closer spiritual spirit better told sugarcoat answer feel somebody kill son mean somebody gettin killed love loyalty passion memory collected moment could never touch wait front spot watch hit block catch leavin service chip throw blower lap walk court black power baby killed coward even keep peace fuck one murder street body hour ghetto bird street paramedic dial somebody touch mama touch sister touch woman touch daddy touch niece touch nephew touch brother chip throw blower lap matter fact bout speak convention call back alright kid gon talk gun control damn place country sound drum bass close eye look around hail mary jesus joseph great american flag wrapped dragged explosive compulsive disorder son daughter barricaded block border look taught u murder street street back street wall street corporate office bank employee boss homicidal thought donald trump office lost barack promised never doubt america honest bask sin pas gin mix american blood bash crippin married blood ask oops accident nasty set u roll dice bet u overnight big rifle fox scared u gang member terrorist et cetera et cetera america reflection mirror place country sound drum bass close eye look aro
baby,Justin Bieber,https://genius.com/Justin-bieber-baby-lyrics,baby baby breaking someone love still wanting even broken lead single bieber debut album world debuted peaked number five justin bieber ludacris love care shout whenever love heart never ever ever apart item quit playin friend sayin said another looked right eye first love broke heart first time baby baby baby baby baby baby baby baby baby thought always mine mine baby baby baby baby baby baby baby baby baby thought always mine mine justin bieber ludacris would done whatever believe together wan play cool losin buy anything buy ring piece baby fix shake til wake bad dream goin believe first love around justin bieber ludacris baby baby baby baby baby baby baby baby baby thought always mine mine baby baby baby baby baby baby baby baby baby thought always mine mine luda thirteen first love nobody compared baby nobody came u could ever goin crazy starstruck woke daily need starbucks made heart pound skip street school playground really wan weekend know dazin amazin heart breakin keep sayin baby baby baby baby baby baby baby baby baby thought always mine mine baby baby baby baby baby baby baby baby baby thought always mine mine gone gone gone gone gone
meet graham,Kendrick Lamar,https://genius.com/Kendrick-lamar-meet-the-grahams-lyrics,ti ng vi bosanski meet graham kendrick lamar kicked may surprise release dis track followed april track euphoria preceded third drake response hour later drake would upload dear adonis sorry father honest take dad responsive look wish grandpa would wore condom sorry ta grow stand behind life hard challenge always gon u home sometimes parent mistake affect u grown good kid need good leadership mentor since daddy teach shit never piss leg son either die right pop head son never fall escort business bad religion please remember could even bitch never code switch whether right wrong black even benefit goal push ups discipline cut corner daddy fuck ozempic pay play brazilian gym membership understand throwin rock hidin hand law ashamed bout wit treat mom kid hide kid hide sure five percent comprehend ninety five lost proud strength within lotta superstar real daddy one nothin carry king understand right play eighteen dear sandra son habit hope undermine especially girl hurt inside climate woman feel alignment emotion hopin blinded dear dennis gave birth master manipulator even using prove huge favor think ask paper paper paper blamin gamblin addiction psychopath intuition play victim raised horrible fuckin person nerve dennis sandra sit heavy listen mm mm son sick sick thought think die weinstein fucked cell rest life hate black woman hypersexualize em kink nympho fetish grew facial hair understood bein beard fit better sex offender ho vo keep monthly allowance child never compromised keepin child around ta raise daughter knowin predator lurkin fuck rap battle die woman live purpose industry twelve year one lil secret weird shit goin artist police streamlinin victim inside home callin em tender leak video push agenda woman playin music playin sister better sellin niece weirdo good one katt williams said truth mine embassy bout raided matter time lebron keep family away curry keep family away anybody embody love kid keep family away lookin standin keep family away lookin shoot pervert life keep family safe dear baby sorry father active inside world commit much music sure narcissist misogynist livin inside song try destroyin family rather taking care teaching time table watchin frozen eleventh birthday singin poem instead turk payin sex poppin percs example deserve wan loved brave kind gift change world could change father mind child future life inside confusion money always illusion life used father prolly claim neither history repeat sometimes need reason would fault hidin another child give grace reason made mr morale baby cope later give confidence somethin hope later never wan hear chase feral behavior sittin club sugar daddy validation need love eternity trump pain father play song rain yes hitmaker songwriter superstar right fuckin deadbeat never life meet graham dear aubrey probably thinkin wanted crash party truthfully hatin bone body supposed good exhibition within game fucked moment called family name stoop low discredit decent people guess integrity lost metaphor reach understand house never home thirty seven showin seven year old gamblin problem drinkin problem pill poppin spendin problem bad money whorehouse solicitin woman problem therapy lovely start suggest ayahuasca strip ego bottom try empathize nothin crave entitlement wan liked bad puzzlin dominance recap moment fit secret handshake friend culture cachet binge disrespectin mother identity fence family love ya skin livin compromised persona channel masculine even standin next woman body shamer gon hide baby mama ya embarrassed em right mama raised u take mask wan achievement believe never gave u nothin believe lied religious view lied surgery lied accent past tense perjury lied ghostwriter lied crew member pussy lied em em lied son lied daughter lied kid hopin lied artist offer help fuck rap battle long life battle
