Song Title,Artist,Song URL,Lyrics
godzilla,Eminem,https://genius.com/Eminem-godzilla-lyrics,magyar godzilla eminem late rapper juice wrld team first time godzilla compare monster particular become godzilla fictional sea monster known mass ugh monster swallow bottle alcohol feel godzilla better hit deck card dealer whole squad walking around party cross zombie apocalypse bobby brain heenan probably reason wrestle mania shady posse consider cross costly mistake sleepin hoe better insomnia adhd hydroxycut pas courvoisier aa ak melee finna set playdate better vacate retreat vacay mayday cray cray ray laughing way bank spray flame tame placate juice wrld eminem monster way feed monster normal day night turn monster moon shine ice road trucker look villain outta blockbuster godzilla fire spitter monster blood dance floor louis carpet fire godzilla fire monster blood dance floor louis carpet product slick rick onyx told em lick ball em appalled many thing pissed em impossible list em midst mental hospital crystal ball tryna still tomorrow risperdal voice whisper fist balled back wall pencil drawn song ballistic pulled pistol guy missile launcher loch ness mythological quick screw fifth vodka twist top bottle juice wrld eminem monster way feed monster normal day night turn monster moon shine ice road trucker look villain outta blockbuster godzilla fire spitter monster blood dance floor louis carpet fire godzilla fire monster blood dance floor louis carpet never gave damn raise hand set trip vacation plan point index ever motherfuckin finger prostate exam fan perspire liar pant fire plan retire still admire chick spazzin handsome flyer em passin hand someone flyer go around come around blade chainsaw caught flack dollar stacked right bat baseball kid ink rack much ease call diddy band call getting cheese cakewalk player motherfuckin stingy cher even lend ear even pretending care marry bury face genital area original richard ramirez cristhian rivera never sit well wan give chair paraplegic scary call hari kari ry tom dick harry carry merriam motherfuckin dictionary em swearing spit shit hilarious time put bitch obituary column eye eye staring problem shaft steering column monster trigger happy pack heat black ink evil half bad meet evil mean take back seat take back fat beat maxi single look rap sheet attracts people gangsta apache catchy jingle stack chip barely half eaten cheeto fill em venom eliminate em word minute maid em wan hurt em fit rage murderin nobody evade finna kill em dump fuckin body lake obliterating everything incinerate renegade em anybody want pen afraid nobody want gon anyway beginnin feel mentally ill attila kill killed killer bee vanilla gorilla bringin killer within outta wan enemy demon entered receivin end stupidity every bit epitome spitter vicinity motherfucker better duck finna dead minute run hundred percent fifth percent bout fuckin finish unfadable wan battle available blowin inflatable undebatable unavoidable unevadable toilet bowl trailer full money paid full afraid pull stop look plannin haha
mercy,Kanye West,https://genius.com/Kanye-west-mercy-lyrics,mercy matthew state blessed merciful shall receive mercy contrast starkly song portrayal mercy symbol materialism excess ironic use mercy well weepin moanin gnashin teeth weepin moanin gnashin teeth come sound champion sound believe believe yb big sean fuzzy jones okay lamborghini mercy chick thirsty two seat lambo tryna jerk believe okay lamborghini mercy chick thirsty two seat lambo tryna jerk okay lamborghini mercy swerve chick thirsty swerve two seat lambo tryna jerk believe okay lamborghini mercy chick thirsty two seat lambo tryna jerk big sean kanye west okay drop floor as shake ground move as quake built house as as state roll roll roll weed as tray ye ye every day day work long night long night payday finally paid need shade vacay nd still hatin much hate need ak paris perrierin white girl politickin sarah palin gettin hot californicatin give born raised yb big sean fuzzy jones okay lamborghini mercy swerve chick thirsty swerve two seat lambo swerve tryna jerk swerve believe okay lamborghini mercy swerve chick thirsty swerve two seat lambo swerve tryna jerk swerve fuzzy jones big sean well weepin moanin swerve gnashin teeth swerve weepin mournin swerve gnashin teeth swerve come sound swerve champion sound swerve believe believe swerve believe believe swerve yuugh prime time top back pimp game ho red leather cocaine rick james ho bill droppin m pac pill poppin as ho poppin blue dolphin need two coffin want heel money need bill money take time count weighs real money check neck check wrist head turnin exorcist audemars mardi gras swiss time excellence two door preference roof gone george jefferson white frost pound cake duncan hines irrelevant lambo murci lago wherever wherever pronto yb big sean fuzzy jones okay lamborghini mercy swerve chick thirsty swerve two seat lambo swerve tryna jerk swerve believe okay lamborghini mercy swerve chick thirsty swerve two seat lambo swerve tryna jerk swerve fuzzy jones big sean well weepin moanin swerve gnashin teeth swerve weepin mournin swerve gnashin teeth swerve come sound swerve champion sound swerve believe believe swerve believe swerve well weepin moanin gnashin teeth dancehall teeth gwan rub pon dem gum cuh time come sound champion sound bugle blown fi many time still one time left cuh amount stripe weh deh pon shoulder kanye west chainz suicide door threw suicide tour bus threw suicide private jet mean fly death step def jam buildin shit em gim fifty million quit rapper taste level waist level turn bass til face level press press kid plus look precious somethin bout mary gone molly whole party melting dal everybody movin body sell apartment move lobby yah loiterin feel important gon lawyer jordan chainz chainz big sean okay catch campaign coupe color mayonnaise drunk high time drinkin champagne airplane spit round gun range rampage hundred band cut need band aid grade chain color akon black diamond backpack rhymin co signed louis vuitton yep horsepower horsepower polo horsepower pound cost four thousand rain want shower rain pourin car foreign broad foreign money tall jordan yb big sean fuzzy jones okay lamborghini mercy swerve chick thirsty swerve two seat lambo swerve tryna jerk swerve okay lamborghini mercy swerve chick thirsty swerve two seat lambo swerve believe tryna jerk swerve believe fuzzy jones big sean well weepin moanin swerve gnashin teeth swerve weepin moanin swerve gnashin teeth swerve come sound swerve champion sound swerve believe believe swerve believe believe swerve well weepin moanin gnashin teeth weepin moanin gnashin teeth come sound champion sound believe believe believe believe
rockstar,Post Malone,https://genius.com/Post-malone-rockstar-lyrics,
jocelyn flores,XXXTENTACION,https://genius.com/Xxxtentacion-jocelyn-flores-lyrics,magyar shqip jocelyn flores jocelyn flores friend suffered depression committed suicide may staying florida photoshoot posted tweet situation later well well mean anything pretty xxxtentacion shiloh dynasty somewhere somewhere trapped mind holding wan pretend something nothing stuck thinking bout hold pretty pain wan put ten shot brain trippin bout thing change suicidal time tame picture bed phone call fucked killed summer nobody helped ever since hate wan fuckin end pessimistic wan pot piss excited bout grave diggin havin conversation bout haste decision fuckin sickenin time memory surface grapevine bout uncle playin slip knot traumatic stress fucked fucked since couple month locked feelin pain feelin pain hold feel numb feelin pain feelin pain hold feel numb well well mean anything pretty well
hotline bling,Drake,https://genius.com/Drake-hotline-bling-lyrics,hotline bling hotline bling likely drake old flame toronto nebby relationship god time instagram account constant reminder never used call used used used call cell phone late night need love call cell phone late night need love hotline bling mean one thing hotline bling mean one thing ever since left city reputation everybody know feel left stressed ever since left city started wearin less goin glass champagne dance floor hangin girl never seen used call cell phone late night need love call cell phone late night need love hotline bling mean one thing hotline bling mean one thing ever since left city along feel wrong goin place belong ever since left city exactly asked runnin page passport hangin girl never seen used call cell phone late night need love call cell phone late night need love hotline bling mean one thing hotline bling mean one thing day wonder bendin backwards someone else wonder rollin backwoods someone else thing taught gettin nasty someone else need one else need nobody else never alone always touchin road used always stay home good zone right someone else used call cell phone late night need love call cell phone late night need love hotline bling mean one thing hotline bling mean one thing ever since left city
mask,Future,https://genius.com/Future-mask-off-lyrics,mask mask serf rag rich story explores surface future past trapping living life luxury slow syrupy production metro boomin sample song call hendrix promise swear swear heard spit percocets molly percocets percocets molly percocets rep set ta rep set chase check never chase mask fuck mask mask fuck mask percocets molly percocets chase check never chase two cup toast gang food stamp whole nother domain yah bottom livin proof compromisin half million coupe drug house lookin peru graduated overdue pink molly barely move ask gon bust move rick james thirty three chain ocean air cruisin biscayne top liability hit gas boostin adrenaline percocets molly percocets percocets molly percocets rep set ta rep set chase check never chase mask fuck mask mask fuck mask percocets molly percocets chase check never chase ford maybach drive anything buy range em insane lord praise guillotine drank promethazine tec beam extreme parliament calamari wednesday parlay vega attendance business theodore lens theo dur prescription focus mission intermission never take break switch state touch foreign plate way fuckin way call play play rob bank gon rob game gang gang percocets molly percocets percocets molly percocets rep set ta rep set chase check never chase mask fuck mask mask fuck mask percocets molly percocets chase check never chase mask fuck mask mask fuck mask mask fuck mask gas gone never nod cold chill prison cell lord praise
closer,The Chainsmokers,https://genius.com/The-chainsmokers-closer-lyrics,closer closer millennial romance anthem celebrates youth heartbreak feature singer songwriter halsey chainsmokers member andrew taggart marking first time chainsmokers fine met drink much issue okay friend nice meet hope never break heart moved city broke car four year call lookin pretty hotel bar stop stop baby pull closer backseat rover afford bite tattoo shoulder pull sheet right corner mattress stole roommate back boulder ever gettin older ever gettin older ever gettin older look good day met forget left insane stay play blink song death tucson okay halsey halsey andrew taggart break heart moved city broke car four year call lookin pretty hotel bar stop stop baby pull closer backseat rover afford bite tattoo shoulder pull sheet right corner mattress stole roommate back boulder ever gettin older ever gettin older ever gettin older baby pull closer backseat rover afford bite tattoo shoulder pull sheet right corner mattress stole roommate back boulder ever gettin older andrew taggart halsey andrew taggart halsey ever gettin older ever gettin older ever gettin older ever gettin older ever gettin older ever gettin older ever gettin older ever gettin older drop halsey halsey andrew taggart older ever gettin older older ever gettin older
swimming pool drank,Kendrick Lamar,https://genius.com/Kendrick-lamar-swimming-pools-drank-lyrics,swimming pool swimming pool lead single good kid city address psychological connection peer pressure alcoholism sound club anthem actually introspective pour head shot sit stand pas wake faded faded done grew round people livin life bottle granddaddy golden flask backstroke every day chicago people way feel people wan kill sorrow people wan fit popular problem dark room loud tune lookin vow soon fucked fillin cup crowd mood changin minute record repeat took sip another sip somebody said babysittin two three shot show turn notch first swimming pool full liquor dive pool full liquor dive wave bottle watch em flock girl wan play baywatch swimming pool full liquor dive po pool full liquor dive pour head shot sit stand pas wake faded faded okay open mind listen kendrick conscience hear history kendrick nauseous right hopin lead victory kendrick take another one drown poison abusin limit think feelin vibe love eye feelin freedom granted soon damage vodka arrived capitalize parental advised apparently influenced doin thought doin til someone said babysittin two three shot show turn notch first swimming pool full liquor dive pool full liquor dive wave bottle watch em flock girl wan play baywatch swimming pool full liquor dive po pool full liquor dive pour head shot sit stand pas wake faded faded ride ride bang one chopper one hundred shot bang hop bang two chopper two hundred shot bang ride ride bang one chopper one hundred shot bang hop bang two chopper two hundred shot bang babysittin two three shot show turn notch first swimming pool full liquor dive pool full liquor dive wave bottle watch em flock girl wan play baywatch swimming pool full liquor dive po pool full liquor dive pour head shot sit stand pas wake faded faded sherane sherane sherane sherane aw sherane takin takin life new appetite failure hunger pain grow insane sound familiar makin excuse relief bottom bottle greenest indo leaf window open release everything corrode inside jokin laugh feel bad probably sleep never ever wake never ever wake never ever wake god trust thought enough stomped homie dot good blood drop drop back straight trippin gon shit pop shot gon ru run opposite way fall right lap gon tear as simple hope set gon pop wait hold somebody car door open gunshot fired aha dot good good bl oo good dave good dave dave somethin dave as killed brother
money tree,Kendrick Lamar,https://genius.com/Kendrick-lamar-money-trees-lyrics,money tree explained credit feeding time ktt summary dot recap story far talk robbing house home invasion persuasive vacant tryna ya bish hit house lick ya bish home invasion persuasive nine five vacant ya bish dream livin life rapper back condom wrapper cool fucked sherane went bros usher raymond burn came hot sauce top ramen ya bish park car start rhymin ya bish thing free mind freeze dollar sign lookin easy ya bish silver spoon ya bish lifestyle never knew reverend revenue halle berry hallelujah pick poison doin everybody gon respect shooter one front gun life forever one front gun forever hustlin day way way canal alleyway money tree perfect place shade feel nah nah dollar might fuck main feel nah dollar might fuck came feel nah nah dollar might lane switch feel nah dollar might turn million rich feel dream livin life rapper bump new school big ballin homies earl stevens u thinkin rational back reality poor ya bish another casualty war ya bish two bullet uncle tony head said one day tour ya bish louis burger never louis belt never ease pain purchase day jerkin pull church pirellis skrrtin gang sign window ya bish hopin em offend ya bish hood pot gold gon crash nobody home halle berry hallelujah pick poison doin everybody gon respect shooter one front gun life forever one front gun forever hustlin day way way canal alleyway money tree perfect place shade feel nah nah dollar might fuck main feel nah dollar might fuck came feel nah nah dollar might lane switch feel nah dollar might turn million rich feel last one dough way love one bucket headed hoe way hit street break code way hit brake patrol way last one dough way love one bucket headed hoe way hit street break code way hit brake patrol way magine rock project pick pocket santa claus miss stocking liquor spillin pistol poppin bakin soda yola whippin turkey thanksgivin homeboy domed hope lord forgive pot cocaine residue every day hustlin else thug eatin cheese government ta provide daughter nem fuck way bish drum band parade bish drop work bush hope boy stash truth last time might as garden grass cut serpent lurkin blood bitch sellin pussy sellin drug good broken promise steal watch time take kick foot locker street heater dungaree dream gettin shaded money tree halle berry hallelujah pick poison doin everybody gon respect shooter one front gun life forever one front gun forever hustlin day way way canal alleyway money tree perfect place shade feel paula duckworth kenneth duckworth kendrick bring car back called another appointment figured gon back time anyway look shit shit wan house one feelin good motherfucker shit tryna thing goin want body going merlin house bring car back want body shit faded feelin good look listen big fat as want body want body big fat as high hell want body big shit even trippin domino bring car back somebody domino
hate love,gnash,https://genius.com/Gnash-i-hate-u-i-love-u-lyrics,hate love olivia brien gnash pair create conflicting love story gnash simply described track missing someone suck important feel time duo feeling used still missing end wan feel kiss lip time passing still seem hurt every time realize much need hate love hate love want put nobody else hate love hate want want need never miss sleep right coffee right eat miss front seat still sand sweater night remember miss miss fucked around attached friend break heart always tired never pulled shit put reel bite shit type text never mind shit feeling never mind shit keep low still love friend wanted would would never hate love hate love want put nobody else hate love hate want want need never mean harm miss arm wedding bell alarm caution tape around heart ever wonder could said fucking lie lie fucking fix drink feeling fucking mixed always missing people missing sometimes ta burn bridge create distance control thought stop reminiscing learned dad good feeling love trust gone guess moving everyone right wrong every lonely night sing song olivia brien gnash hate love hate love want put nobody else hate love hate want want need never olivia brien gnash alone watch watch ever seen care never give damn alone watch watch thing ever seen never notice slowly killing hate love hate love want put nobody else hate love hate want want need never
mr brightside,The Killers,https://genius.com/The-killers-mr-brightside-lyrics,mr brightside killer first ever recorded song demo song composed guitarist dave keuning brandon flower recorded released single comin cage doin fine ta ta want started kiss end kiss kiss falling asleep calling cab smoke taking drag goin bed stomach sick head touching chest take dress look killing taking control jealousy turning saint sea swimming sick lullaby choking alibi price pay destiny calling open eager eye mr brightside comin cage doin fine ta ta want started kiss end kiss falling asleep calling cab havin smoke taking drag goin bed stomach sick head touching chest take dress look killing taking control jealousy turning saint sea swimming sick lullaby choking alibi price pay destiny calling open eager eye mr brightside never never never never
fly moon,Frank Sinatra,https://genius.com/Frank-sinatra-and-count-basie-fly-me-to-the-moon-lyrics,fly moon fly moon popular standard song bart howard originally titled word introduced felicia sander cabaret song became known popularly fly moon play among star spring jupiter mar word hold hand word baby kiss fill heart song sing forevermore long worship adore word please true word love fill heart song sing forevermore long worship adore word please true word word love
role modelz,J. Cole,https://genius.com/J-cole-no-role-modelz-lyrics,role modelz cole belief shallow materialistic hoe way role model talentless reality tv star cole also role model growing first thing first rest peace uncle phil real father ever knew pregnant better prophecy made way back ville fulfilled listen even back broke team ill martin luther king woulda dreamville talk one time sister one time ho lame difference one time save wan saved save wan saved save wan saved save wan saved role model right role model speak searchin memory memory find one last night gettin foot rubbed baddest trina swear god call good sorry never comin home stay good hang phone proceed lay wood came fast white neighborhood shame bout think spoiled rich defensive said nah without thought back back better list celebrity fore started callin bitch bitch heavily back could platinum plaque without melody wadn sweatin one time sister one time ho lame difference one time save wan saved save wan saved save wan saved save wan saved want real love dark skinned aunt viv love jada love leave toothbrush crib love ta wonder whether kid love want reality show touch reality hoe hollywood bringin back five six hoe fuck em kick em deserved bird bird trap think rap would flirt back takin skirt wear shirt fore leave need shirt back one time sister one time ho lame difference one time save wan saved save wan saved save wan saved save wan saved old saying tennessee texas probably tennessee say fool shame shame fool fooled fool one time shame fool twice put blame fool three time fuck peace sign load chopper rain fool one time shame fool twice put blame fool three time fuck peace sign load chopper rain regret young lisa bonet regret young nia long left hoe reality show hand script prolly along regret young sade adu regret could never take aaliyah home left hoe greystone stale face song shallow pussy deep shallow pussy deep shallow pussy deep haha shallow pussy deep save wan saved save wan saved save wan saved save wan saved save wan saved save wan saved save wan saved save wan saved
twelve day christmas,Christmas Songs,https://genius.com/Christmas-songs-the-twelve-days-of-christmas-lyrics,twelve day christmas twelve day christmas christmas carol enumerates day gift given twelve day christmas frederic austin known popularize arrangement first day christmas true love sent partridge pear tree second day christmas true love sent two turtle dove partridge pear tree third day christmas true love sent three french hen two turtle dove partridge pear tree fourth day christmas true love sent four calling bird three french hen two turtle dove partridge pear tree fifth day christmas true love sent five golden ring four calling bird three french hen two turtle dove partridge pear tree sixth day christmas true love sent six goose laying five golden ring four calling bird three french hen two turtle dove partridge pear tree seventh day christmas true love sent seven swan swimming six goose laying five golden ring four calling bird three french hen two turtle dove partridge pear tree eighth day christmas true love sent eight maid milking seven swan swimming six goose laying five golden ring four calling bird three french hen two turtle dove partridge pear tree ninth day christmas true love sent nine lady dancing eight maid milking seven swan swimming six goose laying five golden ring four calling bird three french hen two turtle dove partridge pear tree tenth day christmas true love sent ten lord leaping nine lady dancing eight maid milking seven swan swimming six goose laying five golden ring four calling bird three french hen two turtle dove partridge pear tree eleventh day christmas true love sent eleven piper piping ten lord leaping nine lady dancing eight maid milking seven swan swimming six goose laying five golden ring four calling bird three french hen two turtle dove partridge pear tree twelfth day christmas true love sent twelve drummer drumming eleven piper piping ten lord leaping nine lady dancing eight maid milking seven swan swimming six goose laying five golden ring four calling bird three french hen two turtle dove partridge pear tree
best part,Daniel Caesar,https://genius.com/Daniel-caesar-best-part-lyrics,best best simple though beautiful love song intensity singer value partner teasing several picture instagram possible collaboration daniel caesar babe hold kiss slowly sweetest thing change way would coffee need morning sunshine rain pouring give give wan wan beautiful star follow matter far life movie best best best sunrise brown eye yes one desire wake love make feel nice water stuck desert tylenol take head hurt sunshine life wan beautiful star follow matter far life movie best best best love something love love something love love love something love love something love love love something love love something love love
