Song Title,Artist,Song URL,Lyrics
work,Rihanna,https://genius.com/Rihanna-work-lyrics,work work rihanna seek deep meaningful connection however male character sings interested sex narrative similar rihanna drake previous work work work work work work said haffi work work work work work work mi dirt dirt dirt dirt dirt dirt ah put work work work work work work ah guh learn learn learn learn learn learn nuh cyar hurt hurt hurt hurt hurting dry ah desert nuh time lurking ah act nuh dealt nicest nuh body touch nuh righteous nuh badda text crisis believed dream adoration took heart key patience took heart sleeve decoration mistaken love brought foundation wanted give something never something never seen something never mm wake act nothing wrong ready fi work work work work work work said haffi work work work work work work mi dirt dirt dirt dirt dirt dirt ah put work work work work work work ner ner ner ner ner ner ah guh learn learn learn learn learn learn table turn turn turn turn turn turn beg something please baby leave leave stuck street another chance never never neglect mean hold past hope get hope hope true please recognize tryin babe rihanna drake haffi work work work work work work said haffi work work work work work work mi dirt dirt dirt dirt dirt dirt put work work work work work work ah guh learn learn learn learn learn learn nuh cyar hurt hurt hurt hurt hurting okay drake rihanna need done done done done work need slow motion give away one long distance need ah potential ta twin would still choose wan rush soon need done done done done sorry way less friendly tryna end spilled emotion tonight sorry rollin rollin rollin rollin rollin many shot rollin need face face could pick time place spent time away need forward rihanna rihanna drake give work work work work work work said haffi work work work work work work mi dirt dirt dirt dirt dirt dirt put work work work work work work ah guh learn learn learn learn learn learn nuh cyar hurt hurt hurt hurt hurting rihanna rihanna drake mm mm work work work work work work mm
sad,XXXTENTACION,https://genius.com/Xxxtentacion-sad-lyrics,sloven ina suomi sad sad lament struggle letting loved one feeling depression follows detail emotion uncertainty surrounding specific relationship insecure someone afraid decide ever gon suicide ever try sad sad someone afraid decide ever gon suicide ever try sad sad gave everything took heart left lonely think broken heart contagious fix rather weep lost found torture bein love love around fuckin hate leave someone afraid decide ever gon suicide ever try sad sad someone afraid decide ever gon suicide ever try sad sad someone afraid decide ever gon suicide ever try sad sad someone afraid decide ever gon suicide ever try sad sad
bodak yellow,Cardi B,https://genius.com/Cardi-b-bodak-yellow-lyrics,bodak yellow bodak yellow cardi brings past stripper cemented legitimacy rap game peerless work ethic first single released atlantic record since ksr cardi said shit fuck wanted ta dance said lil fuck wanted expensive red bottom bloody shoe hit store em wan choose quick cut comfortable look dance money move ta dance money move speak mean fuck bos worker bloody move gon find cardi club party paid fee bank much tired honestly give fuck bout fond dropped two mixtapes six month working hard bother hoe hoe bother picture goal tryna look might chill bape might chill boo might feel babe pussy feel lake wan swim face okay want buy yves saint laurent new whip fast horse trunk front hottest street prolly heard bag fixed teeth hope hoe cheap pay mama bill time chill think hoe mad baby father run bill said lil fuck wanted expensive red bottom bloody shoe hit store em wan choose quick cut comfortable look dance money move ta dance money move speak mean fuck bos worker bloody move pussy popped goofy opp around way hang around block checked account turn rich rich rich put hand hip bet dip dip dip money shit hot stove pussy glitter gold lil play role arrove roll came wraith need fill tank need fill safe need hoe none safe dinner steak real relate used live crib gate rollie charm look frosted flake bitch case hoe forgot run check mail another check mona scott said lil fuck wanted expensive red bottom bloody shoe hit store em wan choose quick cut comfortable look dance money move ta dance money move speak mean fuck bos worker bloody move
believer,Imagine Dragons,https://genius.com/Imagine-dragons-believer-lyrics,magyar believer believer thunder around percussive backbeat expressive dan reynolds bring message embracing pain using tool personal growth mark end imagine first thing first word inside head fired tired way thing way thing second thing second think could one sail master sea master sea broken young age taking sulkin mass writing poem look took shook feelin singing heartache pain taking message vein speaking lesson brain seeing beauty pain made made believer believer pain break build believer believer pain bullet fly rain life love drive came pain made made believer believer third thing third send prayer one hate heard turned spirit dove spirit chokin crowd building rain cloud falling ash ground hoping feeling would drown never ever lived ebbin flowin inhibited limited til broke open rained rained pain made made believer believer pain break build believer believer pain bullet fly rain life love drive came pain made made believer believer last thing last grace fire flame face future blood vein blood vein never ever lived ebbin flowin inhibited limited til broke open rained rained pain made made believer believer pain break build believer believer pain bullet fly rain life love drive came pain made made believer believer
fuckin problem,A$AP Rocky,https://genius.com/A-ap-rocky-fuckin-problems-lyrics,fuckin problem star posse cut showcase three distinctive rapper trying stunt subject fucking bad bitch rocky called song reunion drake club paradise tour chainz drake chainz drake ap rocky love bad bitch fuckin problem fuck fuckin problem love bad bitch fuckin problem fuck fuckin problem love bad bitch fuckin problem fuck fuckin problem findin somebody real fuckin problem bring girl crib maybe solve hold bitch simmer takin hella long give thing pop semi nine baby raw shimmy shimmy ya ap never met motherfucker fresh motherfucker wan dress chrome dome sweat keith figure gettin figure fuckin bitch rollin swishers brought bitch brought gettin bent liquor love licorice lick money act niggarish least rich fuckin broad fuckin bored turn dyke fuckin boy beast chainz drake chainz drake love bad bitch fuckin problem fuck fuckin problem love bad bitch fuckin problem fuck fuckin problem love bad bitch fuckin problem fuck fuckin problem findin somebody real fuckin problem bring girl crib maybe solve love think leadin think rapper feedin feelin dude speakin word heard album sleepin print fuckin along fuckin sing along less brought weed along ju okay drop eagle stare star put beatles shit talkin bout discussion pay bigger pay reduction comin trust comin head motherfucker bustin yes lord really often long dick long talkin beast chainz drake chainz drake love bad bitch fuckin problem fuck fuckin problem love bad bitch fuckin problem fuck fuckin problem love bad bitch fuckin problem fuck fuckin problem findin somebody real fuckin problem bring girl crib maybe solve ho finale pep talk turn pep rally hood live inside valley vacayed atlanta goin back cali line world line irony fuck em damn time eyein exist want dick kendrick lamar benz car mean friend e need par standard pampered threesome tomorrow kill em dead body hallway involved listen crystal ball halle berry hallelujah holler back ya beast chainz drake chainz drake love bad bitch fuckin problem fuck fuckin problem love bad bitch fuckin problem fuck fuckin problem love bad bitch fuckin problem fuck fuckin problem findin somebody real fuckin problem bring girl crib maybe solve
good goodbye,Sam Smith,https://genius.com/Sam-smith-too-good-at-goodbyes-lyrics,good goodbye good goodbye tell turbulent personal relationship sam smith first solo release since james bond theme writing wall song lead single must think stupid must think fool must think new seen never gon close even though mean every time open hurt never gon close even mean case leave dirt every time hurt less cry every time leave quicker tear dry every time walk less love baby stand chance sad true way good goodbye way good goodbye thinkin heartless thinkin cold protectin innocence protectin soul never gon close even though mean every time open hurt never gon close even mean case leave dirt every time hurt less cry every time leave quicker tear dry every time walk less love baby stand chance sad true way good goodbye way good goodbye way cry way good goodbye ah ah ah ah every time hurt less cry every time leave quicker tear dry every time walk less love baby stand chance sad true way good goodbye
feeling,Drake,https://genius.com/Drake-in-my-feelings-lyrics,feeling feeling upbeat club mixed love letter kiki kb member city girl track ride drake heartfelt singing honest wondering still love trap trapmoneybenny shit feeling ta real kiki love riding never ever leave beside want ya need ya always kb love riding never ever leave beside want ya need ya always look new really still real swear ta feel try kill ta choice runnin option goin stoppin toppin learnin shoppin spend earned popped ex deserved thought one jump confirmed trapmoneybenny buy champagne love henny block jenny special many resha love riding never ever leave beside want ya need ya always jt love riding never ever leave beside want ya need ya always jt yung miami drake magnolia shorty two bad bitch kissin wraith kissin kissin wraith kiss kissin wraith need black card code safe code safe code code safe safe show neck work fuck netflix chill net net net worth want ya need ya always bad always guess back always al black biggy biggy black biggy black blake always new trade kiki love riding never ever leave beside want need always kb love riding never ever leave beside want ya breakdown lil wayne magnolia shorty skate smoke rap bring as bring as bring as back bring as bring as bring as back shawty hit shawty hit hit miss clap as one love clap as clap clap as bring as back clap clap clap as one love bring as back trap trapmoneybenny shit feeling ta real yup blaqnmild diggin even care need photo drake instagram weak fuck real shit look
take church,Hozier,https://genius.com/Hozier-take-me-to-church-lyrics,norsk take church take church debut single irish recording artist hozier become international hit reaching country certified five time platinum u take lover humour giggle funeral know everybody disapproval worshipped sooner heaven ever speak last true mouthpiece every sunday gettin bleak fresh poison week born sick heard church offer absolute tell worship bedroom heaven sent alone born sick love command well amen amen amen take church worship dog shrine lie sin sharpen knife offer deathless death good god give life take church worship dog shrine lie sin sharpen knife offer deathless death good god give life pagan good time lover sunlight keep goddess side demand sacrifice drain whole sea somethin shiny somethin meaty main course fine lookin high horse stable lot starvin faithful look tasty look plenty hungry work take church worship dog shrine lie sin sharpen knife offer deathless death good god give life take church worship dog shrine lie sin sharpen knife offer deathless death good god give life master king ritual begin sweeter innocence gentle sin madness soil sad earthly scene human clean amen amen amen take church worship dog shrine lie sin sharpen knife offer deathless death good god give life take church worship dog shrine lie sin sharpen knife offer deathless death good god give life
love,Justin Bieber,https://genius.com/Justin-bieber-love-yourself-lyrics,love help benny blanco justin bieber ed sheeran wrote parting song past lover bitter caring love uptempo bieber recent single time rained parade club using name think broke heart goodness sake think cryin well wan write song want anyone thinking still care still hit phone baby movin think somethin wan hold back maybe mama like everyone never admit wrong caught job going better sleeping way look much baby love think still holdin somethin love told hated friend problem every time told opinion wrong tried forget came wan write song want anyone thinking still care still hit phone baby movin think somethin wan hold back maybe mama like everyone never admit wrong caught job going better sleeping way look much baby love think still holdin somethin love time made feel small fell love feel nothin never felt low vulnerable fool break wall way look much baby love think still holdin somethin love way look much baby love think still holdin somethin love
trap queen,Fetty Wap,https://genius.com/Fetty-wap-trap-queen-lyrics,trap queen trap queen gratifying tale fetty wap teaming drug game month releasing song paterson new jersey rgf production remy boyz yah ah hello seen pretty as soon came door wan chill sack u roll married money introduced stove showed whip remixin low trap queen hit bando countin watch far band set goal talkin matchin lambos gram hundred gram though swear love work damn pole hit strip club lettin band everybody hatin call fan though love money never lettin high baby left mall gettin fly baby ride baby kitchen cookin pie baby ride baby left mall gettin fly baby ride baby kitchen cookin pie hello hit strip trap queen band might snatch rari buy boo lamb might snatch necklace drop couple ring wantin nothin everything big zoowap bando remind remy boyz stamp though count hella band though far band fetty wap livin fifty thousand stand though checkin pocket high baby left mall gettin fly baby ride baby kitchen cookin pie baby ride baby left mall gettin fly baby ride baby kitchen cookin pie hello seen pretty as soon came door wan chill sack u roll married money introduced stove showed whip remixin low trap queen hit bando countin watch far band set goal talkin matchin lambos gram hundred gram though swear love work damn pole hit strip club lettin band everybody hatin call fan though love money never lettin smokin dope backwoods roll remy boyz fetty eatin shit fasho run ya house fuck ho remy boyz nothin remy boyz nothin hear soundin zillion buck track whatever whatever put money mouth money wood game good money sight fight put shut nitt gritt rgf production squad
perfect,Ed Sheeran,https://genius.com/Ed-sheeran-perfect-lyrics,perfect perfect old fashioned love ballad inspired dedicated ed fianc cherry seaborn fourth single sheeran album explained motivation found love darlin dive right follow lead well found beautiful sweet never knew someone waitin kid fell love knowin give time darlin kiss slow heart eye holdin mine baby dancin dark arm barefoot grass listenin favourite song said looked mess whispered underneath breath heard darlin look perfect tonight well found woman stronger anyone share dream hope someday home found love carry secret carry love carry child still kid love fightin odds alright time darlin hold hand future eye baby dancin dark arm barefoot grass listenin favourite song saw dress lookin beautiful deserve darlin look perfect tonight mm baby dancin dark arm barefoot grass listenin favourite song faith met angel person look perfect deserve look perfect tonight
city,Kendrick Lamar,https://genius.com/Kendrick-lamar-maad-city-lyrics,city acronym angel angel dust angry adolescence divided also reference compton based hip hop group wc maad circle leader wc kendrick lamar schoolboy pirus crips along probably gun end song seem whole city every time street hear yawk yawk yawk yawk fuck grandma stay city run brace take trip memory lane rap slingin crack move cocaine cul de sac plenty cognac major pain drill sergeant stress weighin brain boog yan yan yg lucky ride rosecrans ugly wavin hand window check warrior conans hope euphoria slow dance society driver seat first one killed seen light skinned brain blown burger stand hang tape recorder sayin ever since day lookin different back nine joey packed nine pakistan every porch fine adapt crime pack van four gun time sliding door fuck fuck shootin walkin fuckin punk pickin fuckin pump pickin sucker suck dick die sucker punch wall bullet comin ak ar duck mama said eatin free lunch aw goddamn hell broke loose killed cousin back fuck truce crawl head noose wind dead news peace treaty piecin bgs approve body top body iv top iv obviously coroner sheet isleys hop trolley sure color correct sure corporate callin mother collect governor collect tax except traffic tragic happens shit threat movin backwards suggest sleep tec buy chopper doctor speed dial guess city fuck grandma stay city run kendrick lamar schoolboy pirus crips along probably gun end song seem whole city every time street hear yawk yawk yawk wake punk as nothin compton thang real simple plain teach lesson street hood nothin compton thang fresh outta school high school grad sleepin livin room mama pad reality struck seen white car crash hit light pole two hopped foot dashed watch pop said needed job thought believed security guard month ended leavin fact fired inspired friend stage robbery third saturday clocked project tore gang sign thrown sup cocaine laced marijuana wonder rarely smoke imagine first blunt foamin mouth straight tweakin next weekend broke even made allegiance made promise bleedin reason still never life kendrick compton human sacrifice cocaine weed mixin shit since loc sherm stick butt nakeds dip flip cluck head block shit one time crooked shit block alondra rosecrans bullis compton still hood loc cool shit hood took follow rule grew hood bang rep color doin thang pas left smoke couple drive bys hood lately couple iv fuckin spray shot crowd everybody ran crew finna slay street life crave shot hit enemy heart turn brave mount regulator whip boulevard pistol grip trip hood still loc grab strap real deal outcome strap hand bird ten grand mothafucka stand told killed sixteen would believe perceive innocent kendrick seen street basketball laters eat mentioned skeleton would jump seat would intelligence great relief safe next generation maybe sleep dream bein lawyer doctor instead chopper hold cul de sac hostage kill em gossip child corn vandalizin option livin lie drown body toxin constantly drinkin drive hit powder watch flame arrive eye listen coward concept aim bang slide deposit price head tithe probably project live inside belly rough compton usa made angel angel dust scratch city compton pas dot bottle damn one fucked holdin always actin unsensitive shit word shut dot good even trip lay back drink
killshot,Eminem,https://genius.com/Eminem-killshot-lyrics,killshot killshot response machine gun kelly rap devil response alike eminem august album kamikaze dis track dropped eleven day rap devil sound shut fuck fan become hater done fuckin beard weird alright yellin mic fuckin weird beard doin yellin mic beard weird yell mic illa rihanna hit text last night left hickey neck wait dissed perplexed insult line compliment next damn really sorry want heart attack watchin mile nordictrack realized forgot call back autograph daughter wrote starter cap stan stan son listen dad mad gon name damn gun bun giant woke eye open undeniable supplyin smoke fire stoked scope grazed one call interscope swayze reply crowd yelling die petty wit corny line ow kelly still outselling three album blew talk somethin really someone daughter mouth stealin food fuckin mole hill mountain ho chill actin put chrome barrel bone marrow gunner bow arrow run phone bill sprayin lead playin dead time hold still eating cereal oatmeal fuck bowl milk wheaties cheerio takin shit em kelly need reading material dictionary slim last four album sucked back recovery shoot three album ago oops fact lil goof luxury broke enough money burn front ho younger wack funny true rather eighty year old twenty year old til hitting old age still fill whole page ten year old rage fan city lil kiddie play feel babysitting lil tay diddy okay spent whole day shootin video fuckin dig grave wake billy goat never made list next biggie jay next taylor swift iggy ho really blow kelly putting name next ja next benzino die motherfucker last motherfucker sayin hailie vain alien brain satanist biggest flop greatest hit game mine nothin changed lock slay mwah give jade kiss ta wake labor day bein rich shamed prick usin name clickbait state bliss said goddamn name ta cock back aim pop champagne moment big gon enjoy give career destroy lethal injection sleep six foot deep give effort three foot eleven look record would suck dick fuckin second lick ballsack channel give life solidified motherfuckin shit rambo bullet good fuckin machine gun outta ammo enough tatted mumble rapper fuck battle fuck kim flannel give sandal know long shady gon live shadow exhausting letting offspring lick gun barrel dance around sombrero fuckin salty young gerald ball deep inside halsey red sweater black leather dress better rap better death threat love letter little white toothpick think pic prick thanks dissing excuse mic write alike really care right losin fight picked else want kells attempt fails budden fuckin nail coffin soft cottonelle killshot fail doc still idiot bos pop pill tell skill kells day put hit day diddy admits put hit pac killed ah sick bein wack still usin mothafuckin auto tune talk sick mumble rap mouth need cock even talk sick blonde hair earring look mirror think marshall mathers mean leave dick mouth keep daughter fuckin playin diddy love
wan na know,Arctic Monkeys,https://genius.com/Arctic-monkeys-do-i-wanna-know-lyrics,wan wan second single premiered live ventura theatre ca may alex portrays obsessive lover paranoid state colour cheek ever fear shift type stick around summat teeth ace sleeve idea deep dreamt nearly every night week many secret keep tune found make think somehow play repeat fall asleep spillin drink settee feelin flow way sorta hopin stay night mainly made sayin thing tomorrow day crawlin back ever thought callin always maybe busy bein fall somebody new thought crawlin back gut wonderin heart still open wan time shuts simmer pucker sorry interrupt constantly cusp tryin kiss feel could together wanted feelin flow way sorta hopin stay night mainly made sayin thing tomorrow day crawlin back ever thought callin always maybe busy bein fall somebody new thought crawlin back feelin flow way sorta hopin stay night mainly made sayin thing tomorrow day busy bein fall ever thought callin darlin want crawlin back
nigga paris,JAŸ-Z,https://genius.com/Jay-z-and-kanye-west-niggas-in-paris-lyrics,paris kanye west xxl magazine october art meet commercial sweet spot hood hollywood conversation karl lagerfeld jay within hour gon skate one song one song ball hard motherfucker wan fine ball hard motherfucker wan fine first ta find fifty grand motherfucker please remind shit crazy shit faze net could look shit gravy shit weird even posed since right fair psycho liable michael take pick jackson tyson jordan game broke clock rollies tick tock audemars losing time hidden behind big rock shocked supposed locked escaped escaped paris getting fucked faded le meurice six day gold bottle scold model spillin ace sick behave might meet ye chi town rose moving net bk jay kanye west ball hard motherfucker wan fine shit cray shit cray shit cray ball hard motherfucker wan fine shit cray shit cray shit cray kanye west jay said ye married mall said look need crawl fore ball meet bathroom stall show deserve ball hard shit cray jay ball hard order fish fillet ball hard whip cold old thing ball hard act ever around motherfucker bougie grab hand fuck wan dance excuse french france haha sayin prince williams right ask would married kate ashley gucci louis killer drug dealer jacket margiela doctor illest suffering realness paris going gorilla even mean one know mean provocative gross get people going ball hard motherfucker wan fine ball hard motherfucker wan fine kanye west jay watching throne zone zone zone lyin actin summer mine hot home many hot bitch zone zone zone zone star building hand ceiling bout kill feeling watching throne zone zone definitely zone
